id,title,brand,category,price,images,description,rating,discountPercentage,tags
179,Corset With Black Skirt,,womens-dresses,79.99,"['https://cdn.dummyjson.com/product-images/womens-dresses/corset-with-black-skirt/1.webp', 'https://cdn.dummyjson.com/product-images/womens-dresses/corset-with-black-skirt/2.webp', 'https://cdn.dummyjson.com/product-images/womens-dresses/corset-with-black-skirt/3.webp', 'https://cdn.dummyjson.com/product-images/womens-dresses/corset-with-black-skirt/4.webp']",The Corset With Black Skirt is a chic and versatile outfit that pairs a fashionable corset with a classic black skirt. It offers a trendy and coordinated look for various occasions.,4.52,15.06,"clothing,corsets,skirts"
180,Dress Pea,,womens-dresses,49.99,"['https://cdn.dummyjson.com/product-images/womens-dresses/dress-pea/1.webp', 'https://cdn.dummyjson.com/product-images/womens-dresses/dress-pea/2.webp', 'https://cdn.dummyjson.com/product-images/womens-dresses/dress-pea/3.webp', 'https://cdn.dummyjson.com/product-images/womens-dresses/dress-pea/4.webp']","The Dress Pea is a stylish and comfortable dress with a pea pattern. Perfect for casual outings, it adds a playful and fun element to your wardrobe, making it a great choice for day-to-day wear.",4.88,17.68,"clothing,dresses"
181,Marni Red & Black Suit,,womens-dresses,179.99,"['https://cdn.dummyjson.com/product-images/womens-dresses/marni-red-&-black-suit/1.webp', 'https://cdn.dummyjson.com/product-images/womens-dresses/marni-red-&-black-suit/2.webp', 'https://cdn.dummyjson.com/product-images/womens-dresses/marni-red-&-black-suit/3.webp', 'https://cdn.dummyjson.com/product-images/womens-dresses/marni-red-&-black-suit/4.webp']","The Marni Red & Black Suit is a sophisticated and fashion-forward suit ensemble. With a combination of red and black tones, it showcases a modern design for a bold and confident look.",4.48,19.02,"clothing,suits"
182,Green Crystal Earring,,womens-jewellery,29.99,"['https://cdn.dummyjson.com/product-images/womens-jewellery/green-crystal-earring/1.webp', 'https://cdn.dummyjson.com/product-images/womens-jewellery/green-crystal-earring/2.webp', 'https://cdn.dummyjson.com/product-images/womens-jewellery/green-crystal-earring/3.webp']","The Green Crystal Earring is a dazzling accessory that features a vibrant green crystal. With a classic design, it adds a touch of elegance to your ensemble, perfect for formal or special occasions.",3.96,15.24,"fashion accessories,earrings"
183,Green Oval Earring,,womens-jewellery,24.99,"['https://cdn.dummyjson.com/product-images/womens-jewellery/green-oval-earring/1.webp', 'https://cdn.dummyjson.com/product-images/womens-jewellery/green-oval-earring/2.webp', 'https://cdn.dummyjson.com/product-images/womens-jewellery/green-oval-earring/3.webp']","The Green Oval Earring is a stylish and versatile accessory with a unique oval shape. Whether for casual or dressy occasions, its green hue and contemporary design make it a standout piece.",3.57,15.18,"fashion accessories,earrings"
184,Tropical Earring,,womens-jewellery,19.99,"['https://cdn.dummyjson.com/product-images/womens-jewellery/tropical-earring/1.webp', 'https://cdn.dummyjson.com/product-images/womens-jewellery/tropical-earring/2.webp', 'https://cdn.dummyjson.com/product-images/womens-jewellery/tropical-earring/3.webp']","The Tropical Earring is a fun and playful accessory inspired by tropical elements. Featuring vibrant colors and a lively design, it's perfect for adding a touch of summer to your look.",4.4,0.76,"fashion accessories,earrings"
185,Black & Brown Slipper,Comfort Trends,womens-shoes,19.99,"['https://cdn.dummyjson.com/product-images/womens-shoes/black-&-brown-slipper/1.webp', 'https://cdn.dummyjson.com/product-images/womens-shoes/black-&-brown-slipper/2.webp', 'https://cdn.dummyjson.com/product-images/womens-shoes/black-&-brown-slipper/3.webp', 'https://cdn.dummyjson.com/product-images/womens-shoes/black-&-brown-slipper/4.webp']","The Black & Brown Slipper is a comfortable and stylish choice for casual wear. Featuring a blend of black and brown colors, it adds a touch of sophistication to your relaxation.",2.53,3.33,"footwear,slippers"
186,Calvin Klein Heel Shoes,Calvin Klein,womens-shoes,79.99,"['https://cdn.dummyjson.com/product-images/womens-shoes/calvin-klein-heel-shoes/1.webp', 'https://cdn.dummyjson.com/product-images/womens-shoes/calvin-klein-heel-shoes/2.webp', 'https://cdn.dummyjson.com/product-images/womens-shoes/calvin-klein-heel-shoes/3.webp', 'https://cdn.dummyjson.com/product-images/womens-shoes/calvin-klein-heel-shoes/4.webp']","Calvin Klein Heel Shoes are elegant and sophisticated, designed for formal occasions. With a classic design and high-quality materials, they complement your stylish ensemble.",4.92,3.19,"footwear,heel shoes"
187,Golden Shoes Woman,Fashion Diva,womens-shoes,49.99,"['https://cdn.dummyjson.com/product-images/womens-shoes/golden-shoes-woman/1.webp', 'https://cdn.dummyjson.com/product-images/womens-shoes/golden-shoes-woman/2.webp', 'https://cdn.dummyjson.com/product-images/womens-shoes/golden-shoes-woman/3.webp', 'https://cdn.dummyjson.com/product-images/womens-shoes/golden-shoes-woman/4.webp']","The Golden Shoes for Women are a glamorous choice for special occasions. Featuring a golden hue and stylish design, they add a touch of luxury to your outfit.",3.26,13.93,"footwear,women's shoes"
188,Pampi Shoes,Pampi,womens-shoes,29.99,"['https://cdn.dummyjson.com/product-images/womens-shoes/pampi-shoes/1.webp', 'https://cdn.dummyjson.com/product-images/womens-shoes/pampi-shoes/2.webp', 'https://cdn.dummyjson.com/product-images/womens-shoes/pampi-shoes/3.webp', 'https://cdn.dummyjson.com/product-images/womens-shoes/pampi-shoes/4.webp']","Pampi Shoes offer a blend of comfort and style for everyday use. With a versatile design, they are suitable for various casual occasions, providing a trendy and relaxed look.",3.05,14.14,"footwear,casual shoes"
189,Red Shoes,Fashion Express,womens-shoes,34.99,"['https://cdn.dummyjson.com/product-images/womens-shoes/red-shoes/1.webp', 'https://cdn.dummyjson.com/product-images/womens-shoes/red-shoes/2.webp', 'https://cdn.dummyjson.com/product-images/womens-shoes/red-shoes/3.webp', 'https://cdn.dummyjson.com/product-images/womens-shoes/red-shoes/4.webp']","The Red Shoes make a bold statement with their vibrant red color. Whether for a party or a casual outing, these shoes add a pop of color and style to your wardrobe.",3.25,17.69,"footwear,women's shoes"
190,IWC Ingenieur Automatic Steel,IWC,womens-watches,4999.99,"['https://cdn.dummyjson.com/product-images/womens-watches/iwc-ingenieur-automatic-steel/1.webp', 'https://cdn.dummyjson.com/product-images/womens-watches/iwc-ingenieur-automatic-steel/2.webp', 'https://cdn.dummyjson.com/product-images/womens-watches/iwc-ingenieur-automatic-steel/3.webp']","The IWC Ingenieur Automatic Steel watch is a durable and sophisticated timepiece. With a stainless steel case and automatic movement, it combines precision and style for watch enthusiasts.",2.93,9.45,"watches,luxury watches"
191,Rolex Cellini Moonphase,Rolex,womens-watches,15999.99,"['https://cdn.dummyjson.com/product-images/womens-watches/rolex-cellini-moonphase/1.webp', 'https://cdn.dummyjson.com/product-images/womens-watches/rolex-cellini-moonphase/2.webp', 'https://cdn.dummyjson.com/product-images/womens-watches/rolex-cellini-moonphase/3.webp']","The Rolex Cellini Moonphase watch is a masterpiece of horology. Featuring a moon phase complication, it showcases the craftsmanship and elegance that Rolex is renowned for.",3.83,4.11,"watches,luxury watches"
192,Rolex Datejust Women,Rolex,womens-watches,10999.99,"['https://cdn.dummyjson.com/product-images/womens-watches/rolex-datejust-women/1.webp', 'https://cdn.dummyjson.com/product-images/womens-watches/rolex-datejust-women/2.webp', 'https://cdn.dummyjson.com/product-images/womens-watches/rolex-datejust-women/3.webp']","The Rolex Datejust Women's watch is an iconic timepiece designed for women. With a timeless design and a date complication, it offers both elegance and functionality.",2.86,15.94,"watches,luxury watches,women's watches"
193,Watch Gold for Women,Fashion Gold,womens-watches,799.99,"['https://cdn.dummyjson.com/product-images/womens-watches/watch-gold-for-women/1.webp', 'https://cdn.dummyjson.com/product-images/womens-watches/watch-gold-for-women/2.webp', 'https://cdn.dummyjson.com/product-images/womens-watches/watch-gold-for-women/3.webp']","The Gold Women's Watch is a stunning accessory that combines luxury and style. Featuring a gold-plated case and a chic design, it adds a touch of glamour to any outfit.",4.24,18.34,"watches,women's watches"
194,Women's Wrist Watch,Fashion Co.,womens-watches,129.99,"[""https://cdn.dummyjson.com/product-images/womens-watches/women's-wrist-watch/1.webp"", ""https://cdn.dummyjson.com/product-images/womens-watches/women's-wrist-watch/2.webp"", ""https://cdn.dummyjson.com/product-images/womens-watches/women's-wrist-watch/3.webp""]","The Women's Wrist Watch is a versatile and fashionable timepiece for everyday wear. With a comfortable strap and a simple yet elegant design, it complements various styles.",3.52,12.6,"watches,women's watches"
