id,title,brand,category,price,images,description,rating,discountPercentage,tags
127,Oppo K1,Oppo,smartphones,299.99,"['https://cdn.dummyjson.com/product-images/smartphones/oppo-k1/1.webp', 'https://cdn.dummyjson.com/product-images/smartphones/oppo-k1/2.webp', 'https://cdn.dummyjson.com/product-images/smartphones/oppo-k1/3.webp', 'https://cdn.dummyjson.com/product-images/smartphones/oppo-k1/4.webp']","The Oppo K1 series offers a range of smartphones with various features and specifications. Known for their stylish design and reliable performance, the Oppo K1 series caters to diverse user preferences.",4.25,18.29,"smartphones,oppo"
128,Realme C35,Realme,smartphones,149.99,"['https://cdn.dummyjson.com/product-images/smartphones/realme-c35/1.webp', 'https://cdn.dummyjson.com/product-images/smartphones/realme-c35/2.webp', 'https://cdn.dummyjson.com/product-images/smartphones/realme-c35/3.webp']",The Realme C35 is a budget-friendly smartphone with a focus on providing essential features for everyday use. It offers a reliable performance and user-friendly experience.,4.2,15.3,"smartphones,realme"
129,Realme X,Realme,smartphones,299.99,"['https://cdn.dummyjson.com/product-images/smartphones/realme-x/1.webp', 'https://cdn.dummyjson.com/product-images/smartphones/realme-x/2.webp', 'https://cdn.dummyjson.com/product-images/smartphones/realme-x/3.webp']",The Realme X is a mid-range smartphone known for its sleek design and impressive display. It offers a good balance of performance and camera capabilities for users seeking a quality device.,3.7,6.95,"smartphones,realme"
130,Realme XT,Realme,smartphones,349.99,"['https://cdn.dummyjson.com/product-images/smartphones/realme-xt/1.webp', 'https://cdn.dummyjson.com/product-images/smartphones/realme-xt/2.webp', 'https://cdn.dummyjson.com/product-images/smartphones/realme-xt/3.webp']","The Realme XT is a feature-rich smartphone with a focus on camera technology. It comes equipped with advanced camera sensors, delivering high-quality photos and videos for photography enthusiasts.",4.58,11.51,"smartphones,realme"
131,Samsung Galaxy S7,Samsung,smartphones,299.99,"['https://cdn.dummyjson.com/product-images/smartphones/samsung-galaxy-s7/1.webp', 'https://cdn.dummyjson.com/product-images/smartphones/samsung-galaxy-s7/2.webp', 'https://cdn.dummyjson.com/product-images/smartphones/samsung-galaxy-s7/3.webp']","The Samsung Galaxy S7 is a flagship smartphone known for its sleek design and advanced features. It features a high-resolution display, powerful camera, and robust performance.",3.3,19.55,"smartphones,samsung galaxy"
132,Samsung Galaxy S8,Samsung,smartphones,499.99,"['https://cdn.dummyjson.com/product-images/smartphones/samsung-galaxy-s8/1.webp', 'https://cdn.dummyjson.com/product-images/smartphones/samsung-galaxy-s8/2.webp', 'https://cdn.dummyjson.com/product-images/smartphones/samsung-galaxy-s8/3.webp']","The Samsung Galaxy S8 is a premium smartphone with an Infinity Display, offering a stunning visual experience. It boasts advanced camera capabilities and cutting-edge technology.",4.4,19.45,"smartphones,samsung galaxy"
133,Samsung Galaxy S10,Samsung,smartphones,699.99,"['https://cdn.dummyjson.com/product-images/smartphones/samsung-galaxy-s10/1.webp', 'https://cdn.dummyjson.com/product-images/smartphones/samsung-galaxy-s10/2.webp', 'https://cdn.dummyjson.com/product-images/smartphones/samsung-galaxy-s10/3.webp']","The Samsung Galaxy S10 is a flagship device featuring a dynamic AMOLED display, versatile camera system, and powerful performance. It represents innovation and excellence in smartphone technology.",3.06,5.59,"smartphones,samsung galaxy"
134,Vivo S1,Vivo,smartphones,249.99,"['https://cdn.dummyjson.com/product-images/smartphones/vivo-s1/1.webp', 'https://cdn.dummyjson.com/product-images/smartphones/vivo-s1/2.webp', 'https://cdn.dummyjson.com/product-images/smartphones/vivo-s1/3.webp']","The Vivo S1 is a stylish and mid-range smartphone offering a blend of design and performance. It features a vibrant display, capable camera system, and reliable functionality.",3.5,10.17,"smartphones,vivo"
135,Vivo V9,Vivo,smartphones,299.99,"['https://cdn.dummyjson.com/product-images/smartphones/vivo-v9/1.webp', 'https://cdn.dummyjson.com/product-images/smartphones/vivo-v9/2.webp', 'https://cdn.dummyjson.com/product-images/smartphones/vivo-v9/3.webp']","The Vivo V9 is a smartphone known for its sleek design and emphasis on capturing high-quality selfies. It features a notch display, dual-camera setup, and a modern design.",3.6,17.67,"smartphones,vivo"
136,Vivo X21,Vivo,smartphones,499.99,"['https://cdn.dummyjson.com/product-images/smartphones/vivo-x21/1.webp', 'https://cdn.dummyjson.com/product-images/smartphones/vivo-x21/2.webp', 'https://cdn.dummyjson.com/product-images/smartphones/vivo-x21/3.webp']","The Vivo X21 is a premium smartphone with a focus on cutting-edge technology. It features an in-display fingerprint sensor, a high-resolution display, and advanced camera capabilities.",4.26,17.41,"smartphones,vivo"
137,American Football,,sports-accessories,19.99,['https://cdn.dummyjson.com/product-images/sports-accessories/american-football/1.webp'],"The American Football is a classic ball used in American football games. It is designed for throwing and catching, making it an essential piece of equipment for the sport.",4.91,4.93,"sports equipment,american football"
138,Baseball Ball,,sports-accessories,8.99,['https://cdn.dummyjson.com/product-images/sports-accessories/baseball-ball/1.webp'],"The Baseball Ball is a standard baseball used in baseball games. It features a durable leather cover and is designed for pitching, hitting, and fielding in the game of baseball.",2.57,1.71,"sports equipment,baseball"
139,Baseball Glove,,sports-accessories,24.99,"['https://cdn.dummyjson.com/product-images/sports-accessories/baseball-glove/1.webp', 'https://cdn.dummyjson.com/product-images/sports-accessories/baseball-glove/2.webp', 'https://cdn.dummyjson.com/product-images/sports-accessories/baseball-glove/3.webp']","The Baseball Glove is a protective glove worn by baseball players. It is designed to catch and field the baseball, providing players with comfort and control during the game.",3.96,2.9,"sports equipment,baseball"
140,Basketball,,sports-accessories,14.99,['https://cdn.dummyjson.com/product-images/sports-accessories/basketball/1.webp'],"The Basketball is a standard ball used in basketball games. It is designed for dribbling, shooting, and passing in the game of basketball, suitable for both indoor and outdoor play.",4.66,7.44,"sports equipment,basketball"
141,Basketball Rim,,sports-accessories,39.99,['https://cdn.dummyjson.com/product-images/sports-accessories/basketball-rim/1.webp'],The Basketball Rim is a sturdy hoop and net assembly mounted on a basketball backboard. It provides a target for shooting and scoring in the game of basketball.,4.6,7.74,"sports equipment,basketball"
142,Cricket Ball,,sports-accessories,12.99,['https://cdn.dummyjson.com/product-images/sports-accessories/cricket-ball/1.webp'],"The Cricket Ball is a hard leather ball used in the sport of cricket. It is bowled and batted in the game, and its hardness and seam contribute to the dynamics of cricket play.",3.53,8.63,"sports equipment,cricket"
143,Cricket Bat,,sports-accessories,29.99,['https://cdn.dummyjson.com/product-images/sports-accessories/cricket-bat/1.webp'],The Cricket Bat is an essential piece of cricket equipment used by batsmen to hit the cricket ball. It is made of wood and comes in various sizes and designs.,3.17,3.29,"sports equipment,cricket"
144,Cricket Helmet,,sports-accessories,44.99,"['https://cdn.dummyjson.com/product-images/sports-accessories/cricket-helmet/1.webp', 'https://cdn.dummyjson.com/product-images/sports-accessories/cricket-helmet/2.webp', 'https://cdn.dummyjson.com/product-images/sports-accessories/cricket-helmet/3.webp', 'https://cdn.dummyjson.com/product-images/sports-accessories/cricket-helmet/4.webp']","The Cricket Helmet is a protective headgear worn by cricket players, especially batsmen and wicketkeepers. It provides protection against fast bowling and bouncers.",4.69,9.64,"sports equipment,cricket"
145,Cricket Wicket,,sports-accessories,29.99,['https://cdn.dummyjson.com/product-images/sports-accessories/cricket-wicket/1.webp'],"The Cricket Wicket is a set of three stumps and two bails, forming a wicket used in the sport of cricket. Batsmen aim to protect the wicket while scoring runs.",4.73,16.93,"sports equipment,cricket"
146,Feather Shuttlecock,,sports-accessories,5.99,['https://cdn.dummyjson.com/product-images/sports-accessories/feather-shuttlecock/1.webp'],"The Feather Shuttlecock is used in the sport of badminton. It features natural feathers and is designed for high-speed play, providing stability and accuracy during matches.",2.85,2.95,"sports equipment,badminton"
147,Football,,sports-accessories,17.99,['https://cdn.dummyjson.com/product-images/sports-accessories/football/1.webp'],"The Football, also known as a soccer ball, is the standard ball used in the sport of football (soccer). It is designed for kicking and passing in the game.",3.28,5.15,"sports equipment,football"
148,Golf Ball,,sports-accessories,9.99,['https://cdn.dummyjson.com/product-images/sports-accessories/golf-ball/1.webp'],"The Golf Ball is a small ball used in the sport of golf. It features dimples on its surface, providing aerodynamic lift and distance when struck by a golf club.",4.3,17.37,"sports equipment,golf"
149,Iron Golf,,sports-accessories,49.99,['https://cdn.dummyjson.com/product-images/sports-accessories/iron-golf/1.webp'],"The Iron Golf is a type of golf club designed for various golf shots. It features a solid metal head and is used for approach shots, chipping, and other golfing techniques.",4.41,6.53,"sports equipment,golf"
150,Metal Baseball Bat,,sports-accessories,29.99,['https://cdn.dummyjson.com/product-images/sports-accessories/metal-baseball-bat/1.webp'],The Metal Baseball Bat is a durable and lightweight baseball bat made from metal alloys. It is commonly used in baseball games for hitting and batting practice.,4.66,19.51,"sports equipment,baseball"
151,Tennis Ball,,sports-accessories,6.99,['https://cdn.dummyjson.com/product-images/sports-accessories/tennis-ball/1.webp'],The Tennis Ball is a standard ball used in the sport of tennis. It is designed for bouncing and hitting with tennis rackets during matches or practice sessions.,4.06,11.76,"sports equipment,tennis"
152,Tennis Racket,,sports-accessories,49.99,['https://cdn.dummyjson.com/product-images/sports-accessories/tennis-racket/1.webp'],"The Tennis Racket is an essential piece of equipment used in the sport of tennis. It features a frame with strings and a grip, allowing players to hit the tennis ball.",4.03,19.61,"sports equipment,tennis"
153,Volleyball,,sports-accessories,11.99,['https://cdn.dummyjson.com/product-images/sports-accessories/volleyball/1.webp'],"The Volleyball is a standard ball used in the sport of volleyball. It is designed for passing, setting, and spiking over the net during volleyball matches.",3.84,12.25,"sports equipment,volleyball"
154,Black Sun Glasses,Fashion Shades,sunglasses,29.99,"['https://cdn.dummyjson.com/product-images/sunglasses/black-sun-glasses/1.webp', 'https://cdn.dummyjson.com/product-images/sunglasses/black-sun-glasses/2.webp', 'https://cdn.dummyjson.com/product-images/sunglasses/black-sun-glasses/3.webp']","The Black Sun Glasses are a classic and stylish choice, featuring a sleek black frame and tinted lenses. They provide both UV protection and a fashionable look.",4.41,4.94,"eyewear,sunglasses"
155,Classic Sun Glasses,Fashion Shades,sunglasses,24.99,"['https://cdn.dummyjson.com/product-images/sunglasses/classic-sun-glasses/1.webp', 'https://cdn.dummyjson.com/product-images/sunglasses/classic-sun-glasses/2.webp', 'https://cdn.dummyjson.com/product-images/sunglasses/classic-sun-glasses/3.webp']",The Classic Sun Glasses offer a timeless design with a neutral frame and UV-protected lenses. These sunglasses are versatile and suitable for various occasions.,3.86,4.94,"eyewear,sunglasses"
156,Green and Black Glasses,Fashion Shades,sunglasses,34.99,"['https://cdn.dummyjson.com/product-images/sunglasses/green-and-black-glasses/1.webp', 'https://cdn.dummyjson.com/product-images/sunglasses/green-and-black-glasses/2.webp', 'https://cdn.dummyjson.com/product-images/sunglasses/green-and-black-glasses/3.webp']","The Green and Black Glasses feature a bold combination of green and black colors, adding a touch of vibrancy to your eyewear collection. They are both stylish and eye-catching.",4.55,1.01,"eyewear,sunglasses"
157,Party Glasses,Fashion Fun,sunglasses,19.99,"['https://cdn.dummyjson.com/product-images/sunglasses/party-glasses/1.webp', 'https://cdn.dummyjson.com/product-images/sunglasses/party-glasses/2.webp', 'https://cdn.dummyjson.com/product-images/sunglasses/party-glasses/3.webp']","The Party Glasses are designed to add flair to your party outfit. With unique shapes or colorful frames, they're perfect for adding a playful touch to your look during celebrations.",2.79,11.22,"eyewear,party glasses"
158,Sunglasses,Fashion Shades,sunglasses,22.99,"['https://cdn.dummyjson.com/product-images/sunglasses/sunglasses/1.webp', 'https://cdn.dummyjson.com/product-images/sunglasses/sunglasses/2.webp', 'https://cdn.dummyjson.com/product-images/sunglasses/sunglasses/3.webp']",The Sunglasses offer a classic and simple design with a focus on functionality. These sunglasses provide essential UV protection while maintaining a timeless look.,3.02,1.51,"eyewear,sunglasses"
159,iPad Mini 2021 Starlight,Apple,tablets,499.99,"['https://cdn.dummyjson.com/product-images/tablets/ipad-mini-2021-starlight/1.webp', 'https://cdn.dummyjson.com/product-images/tablets/ipad-mini-2021-starlight/2.webp', 'https://cdn.dummyjson.com/product-images/tablets/ipad-mini-2021-starlight/3.webp', 'https://cdn.dummyjson.com/product-images/tablets/ipad-mini-2021-starlight/4.webp']","The iPad Mini 2021 in Starlight is a compact and powerful tablet from Apple. Featuring a stunning Retina display, powerful A-series chip, and a sleek design, it offers a premium tablet experience.",3.18,3.64,"electronics,tablets"
160,Samsung Galaxy Tab S8 Plus Grey,Samsung,tablets,599.99,"['https://cdn.dummyjson.com/product-images/tablets/samsung-galaxy-tab-s8-plus-grey/1.webp', 'https://cdn.dummyjson.com/product-images/tablets/samsung-galaxy-tab-s8-plus-grey/2.webp', 'https://cdn.dummyjson.com/product-images/tablets/samsung-galaxy-tab-s8-plus-grey/3.webp', 'https://cdn.dummyjson.com/product-images/tablets/samsung-galaxy-tab-s8-plus-grey/4.webp']","The Samsung Galaxy Tab S8 Plus in Grey is a high-performance Android tablet by Samsung. With a large AMOLED display, powerful processor, and S Pen support, it's ideal for productivity and entertainment.",4.68,13.31,"electronics,tablets"
161,Samsung Galaxy Tab White,Samsung,tablets,349.99,"['https://cdn.dummyjson.com/product-images/tablets/samsung-galaxy-tab-white/1.webp', 'https://cdn.dummyjson.com/product-images/tablets/samsung-galaxy-tab-white/2.webp', 'https://cdn.dummyjson.com/product-images/tablets/samsung-galaxy-tab-white/3.webp', 'https://cdn.dummyjson.com/product-images/tablets/samsung-galaxy-tab-white/4.webp']","The Samsung Galaxy Tab in White is a sleek and versatile Android tablet. With a vibrant display, long-lasting battery, and a range of features, it offers a great user experience for various tasks.",3.72,18.2,"electronics,tablets"
162,Blue Frock,,tops,29.99,"['https://cdn.dummyjson.com/product-images/tops/blue-frock/1.webp', 'https://cdn.dummyjson.com/product-images/tops/blue-frock/2.webp', 'https://cdn.dummyjson.com/product-images/tops/blue-frock/3.webp', 'https://cdn.dummyjson.com/product-images/tops/blue-frock/4.webp']","The Blue Frock is a charming and stylish dress for various occasions. With a vibrant blue color and a comfortable design, it adds a touch of elegance to your wardrobe.",4.17,12.13,"clothing,dresses"
163,Girl Summer Dress,,tops,19.99,"['https://cdn.dummyjson.com/product-images/tops/girl-summer-dress/1.webp', 'https://cdn.dummyjson.com/product-images/tops/girl-summer-dress/2.webp', 'https://cdn.dummyjson.com/product-images/tops/girl-summer-dress/3.webp', 'https://cdn.dummyjson.com/product-images/tops/girl-summer-dress/4.webp']","The Girl Summer Dress is a cute and breezy dress designed for warm weather. With playful patterns and lightweight fabric, it's perfect for keeping cool and stylish during the summer.",4.77,19.2,"clothing,girls' dresses"
164,Gray Dress,,tops,34.99,"['https://cdn.dummyjson.com/product-images/tops/gray-dress/1.webp', 'https://cdn.dummyjson.com/product-images/tops/gray-dress/2.webp', 'https://cdn.dummyjson.com/product-images/tops/gray-dress/3.webp', 'https://cdn.dummyjson.com/product-images/tops/gray-dress/4.webp']","The Gray Dress is a versatile and chic option for various occasions. With a neutral gray color, it can be dressed up or down, making it a wardrobe staple for any fashion-forward individual.",2.72,14.28,"clothing,dresses"
165,Short Frock,,tops,24.99,"['https://cdn.dummyjson.com/product-images/tops/short-frock/1.webp', 'https://cdn.dummyjson.com/product-images/tops/short-frock/2.webp', 'https://cdn.dummyjson.com/product-images/tops/short-frock/3.webp', 'https://cdn.dummyjson.com/product-images/tops/short-frock/4.webp']","The Short Frock is a playful and trendy dress with a shorter length. Ideal for casual outings or special occasions, it combines style and comfort for a fashionable look.",3.23,13.45,"clothing,dresses"
166,Tartan Dress,,tops,39.99,"['https://cdn.dummyjson.com/product-images/tops/tartan-dress/1.webp', 'https://cdn.dummyjson.com/product-images/tops/tartan-dress/2.webp', 'https://cdn.dummyjson.com/product-images/tops/tartan-dress/3.webp', 'https://cdn.dummyjson.com/product-images/tops/tartan-dress/4.webp']","The Tartan Dress features a classic tartan pattern, bringing a timeless and sophisticated touch to your wardrobe. Perfect for fall and winter, it adds a hint of traditional charm.",4.05,12.95,"clothing,dresses"
167,300 Touring,Chrysler,vehicle,28999.99,"['https://cdn.dummyjson.com/product-images/vehicle/300-touring/1.webp', 'https://cdn.dummyjson.com/product-images/vehicle/300-touring/2.webp', 'https://cdn.dummyjson.com/product-images/vehicle/300-touring/3.webp', 'https://cdn.dummyjson.com/product-images/vehicle/300-touring/4.webp', 'https://cdn.dummyjson.com/product-images/vehicle/300-touring/5.webp', 'https://cdn.dummyjson.com/product-images/vehicle/300-touring/6.webp']","The 300 Touring is a stylish and comfortable sedan, known for its luxurious features and smooth performance.",4.05,3.98,"sedans,vehicles"
168,Charger SXT RWD,Dodge,vehicle,32999.99,"['https://cdn.dummyjson.com/product-images/vehicle/charger-sxt-rwd/1.webp', 'https://cdn.dummyjson.com/product-images/vehicle/charger-sxt-rwd/2.webp', 'https://cdn.dummyjson.com/product-images/vehicle/charger-sxt-rwd/3.webp', 'https://cdn.dummyjson.com/product-images/vehicle/charger-sxt-rwd/4.webp', 'https://cdn.dummyjson.com/product-images/vehicle/charger-sxt-rwd/5.webp', 'https://cdn.dummyjson.com/product-images/vehicle/charger-sxt-rwd/6.webp']","The Charger SXT RWD is a powerful and sporty rear-wheel-drive sedan, offering a blend of performance and practicality.",2.58,8.23,"sedans,sports cars,vehicles"
169,Dodge Hornet GT Plus,Dodge,vehicle,24999.99,"['https://cdn.dummyjson.com/product-images/vehicle/dodge-hornet-gt-plus/1.webp', 'https://cdn.dummyjson.com/product-images/vehicle/dodge-hornet-gt-plus/2.webp', 'https://cdn.dummyjson.com/product-images/vehicle/dodge-hornet-gt-plus/3.webp', 'https://cdn.dummyjson.com/product-images/vehicle/dodge-hornet-gt-plus/4.webp', 'https://cdn.dummyjson.com/product-images/vehicle/dodge-hornet-gt-plus/5.webp', 'https://cdn.dummyjson.com/product-images/vehicle/dodge-hornet-gt-plus/6.webp']","The Dodge Hornet GT Plus is a compact and agile hatchback, perfect for urban driving with a touch of sportiness.",2.65,2.63,"hatchbacks,compact cars,vehicles"
170,Durango SXT RWD,Dodge,vehicle,36999.99,"['https://cdn.dummyjson.com/product-images/vehicle/durango-sxt-rwd/1.webp', 'https://cdn.dummyjson.com/product-images/vehicle/durango-sxt-rwd/2.webp', 'https://cdn.dummyjson.com/product-images/vehicle/durango-sxt-rwd/3.webp', 'https://cdn.dummyjson.com/product-images/vehicle/durango-sxt-rwd/4.webp', 'https://cdn.dummyjson.com/product-images/vehicle/durango-sxt-rwd/5.webp', 'https://cdn.dummyjson.com/product-images/vehicle/durango-sxt-rwd/6.webp']","The Durango SXT RWD is a spacious and versatile SUV, known for its strong performance and family-friendly features.",4.07,16.44,"suvs,vehicles"
171,Pacifica Touring,Chrysler,vehicle,31999.99,"['https://cdn.dummyjson.com/product-images/vehicle/pacifica-touring/1.webp', 'https://cdn.dummyjson.com/product-images/vehicle/pacifica-touring/2.webp', 'https://cdn.dummyjson.com/product-images/vehicle/pacifica-touring/3.webp', 'https://cdn.dummyjson.com/product-images/vehicle/pacifica-touring/4.webp', 'https://cdn.dummyjson.com/product-images/vehicle/pacifica-touring/5.webp', 'https://cdn.dummyjson.com/product-images/vehicle/pacifica-touring/6.webp']","The Pacifica Touring is a stylish and well-equipped minivan, offering comfort and convenience for family journeys.",3.62,14.76,"minivans,vehicles"
172,Blue Women's Handbag,Fashionista,womens-bags,49.99,"[""https://cdn.dummyjson.com/product-images/womens-bags/blue-women's-handbag/1.webp"", ""https://cdn.dummyjson.com/product-images/womens-bags/blue-women's-handbag/2.webp"", ""https://cdn.dummyjson.com/product-images/womens-bags/blue-women's-handbag/3.webp""]","The Blue Women's Handbag is a stylish and spacious accessory for everyday use. With a vibrant blue color and multiple compartments, it combines fashion and functionality.",2.92,17.88,"fashion accessories,handbags"
173,Heshe Women's Leather Bag,Heshe,womens-bags,129.99,"[""https://cdn.dummyjson.com/product-images/womens-bags/heshe-women's-leather-bag/1.webp"", ""https://cdn.dummyjson.com/product-images/womens-bags/heshe-women's-leather-bag/2.webp"", ""https://cdn.dummyjson.com/product-images/womens-bags/heshe-women's-leather-bag/3.webp""]","The Heshe Women's Leather Bag is a luxurious and high-quality leather bag for the sophisticated woman. With a timeless design and durable craftsmanship, it's a versatile accessory.",4.92,3.87,"fashion accessories,leather bags"
174,Prada Women Bag,Prada,womens-bags,599.99,"['https://cdn.dummyjson.com/product-images/womens-bags/prada-women-bag/1.webp', 'https://cdn.dummyjson.com/product-images/womens-bags/prada-women-bag/2.webp', 'https://cdn.dummyjson.com/product-images/womens-bags/prada-women-bag/3.webp']","The Prada Women Bag is an iconic designer bag that exudes elegance and luxury. Crafted with precision and featuring the Prada logo, it's a statement piece for fashion enthusiasts.",2.71,14.09,"fashion accessories,designer bags"
175,White Faux Leather Backpack,Urban Chic,womens-bags,39.99,"['https://cdn.dummyjson.com/product-images/womens-bags/white-faux-leather-backpack/1.webp', 'https://cdn.dummyjson.com/product-images/womens-bags/white-faux-leather-backpack/2.webp', 'https://cdn.dummyjson.com/product-images/womens-bags/white-faux-leather-backpack/3.webp']","The White Faux Leather Backpack is a trendy and practical backpack for the modern woman. With a sleek white design and ample storage space, it's perfect for both casual and on-the-go styles.",3.36,15.2,"fashion accessories,backpacks"
176,Women Handbag Black,Elegance Collection,womens-bags,59.99,"['https://cdn.dummyjson.com/product-images/womens-bags/women-handbag-black/1.webp', 'https://cdn.dummyjson.com/product-images/womens-bags/women-handbag-black/2.webp', 'https://cdn.dummyjson.com/product-images/womens-bags/women-handbag-black/3.webp']","The Women Handbag in Black is a classic and versatile accessory that complements various outfits. With a timeless black color and functional design, it's a must-have in every woman's wardrobe.",2.89,11.63,"fashion accessories,handbags"
177,Black Women's Gown,,womens-dresses,129.99,"[""https://cdn.dummyjson.com/product-images/womens-dresses/black-women's-gown/1.webp"", ""https://cdn.dummyjson.com/product-images/womens-dresses/black-women's-gown/2.webp"", ""https://cdn.dummyjson.com/product-images/womens-dresses/black-women's-gown/3.webp"", ""https://cdn.dummyjson.com/product-images/womens-dresses/black-women's-gown/4.webp""]","The Black Women's Gown is an elegant and timeless evening gown. With a sleek black design, it's perfect for formal events and special occasions, exuding sophistication and style.",3.64,10.48,"clothing,gowns"
178,Corset Leather With Skirt,,womens-dresses,89.99,"['https://cdn.dummyjson.com/product-images/womens-dresses/corset-leather-with-skirt/1.webp', 'https://cdn.dummyjson.com/product-images/womens-dresses/corset-leather-with-skirt/2.webp', 'https://cdn.dummyjson.com/product-images/womens-dresses/corset-leather-with-skirt/3.webp', 'https://cdn.dummyjson.com/product-images/womens-dresses/corset-leather-with-skirt/4.webp']","The Corset Leather With Skirt is a bold and edgy ensemble that combines a stylish corset with a matching skirt. Ideal for fashion-forward individuals, it makes a statement at any event.",3.05,16.26,"clothing,corsets,skirts"
